{"$schema":"https://json-schema.org/draft/2020-12/schema","title":"Project Supernova Atomic Transition Receipt v2.4","type":"object","additionalProperties":false,"required":["task_network_plan_id","transition_id","parent_state_blob","expected_base_head","new_generation","new_cohort_id","control_blob","assignment_blob","state_blob","required_ci_contexts","repo_policy_observed_protected","created_by","next_action"],"properties":{"task_network_plan_id":{"const":"0aa341106cfc5b104ab9ca9c2ae116d490a258685e28d26d5435860c53bb12aa"},"transition_id":{"type":"string"},"parent_state_blob":{"type":"string","pattern":"^[0-9a-f]{40}$"},"expected_base_head":{"type":"string","pattern":"^[0-9a-f]{40}$"},"new_generation":{"type":"integer","minimum":1},"new_cohort_id":{"type":"string"},"control_blob":{"type":"string","pattern":"^[0-9a-f]{40}$"},"assignment_blob":{"type":"string","pattern":"^[0-9a-f]{40}$"},"state_blob":{"type":"string","pattern":"^[0-9a-f]{40}$"},"required_ci_contexts":{"type":"array","items":{"type":"string"}},"repo_policy_observed_protected":{"type":"boolean"},"created_by":{"type":"string"},"next_action":{"type":"string"}}}
